{
	"id": "PropertyName-Quality-Observed-GBOX000014",
	"type": "Device",
	"name": "GBOX000014",
	"category": [
		"airPollution",
		"noiseLevel",
		"noiseLevel",
		"salinity",
		"noiseLevel"
	],
	"description": "Description du constituant qui posséde une liste de sites ou du boitier qui possède une liste de voies ou canaux",
	"address": {
		"postalCode": "06200",
		"addressLocality": "NICE",
		"addressRegion": "Alpes Maritimes",
		"addressCountry": "FR",
		"streetAddress": "Av Cyrille Besset"
	},
	"location": {
		"type": "Point",
		"coordinates": [
			7.1552125224843621,
			43.660530261510573
		]
	},
	"brandName": "La marque",
	"modelName": "Modèle du device",
	"manufactureName": "Nom du fabricant",
	"dateManufactured": "2017-06-13",
	"serialNumber": "Numéro de serie",
	"supportedProtocol": [
		"ul20",
		"mqtt",
		"lora"
	],
	"dateInstalled": "2017-10-31T06:00:00",
	"dateCreated": "305.00.12 (Sur le nom du fichier) converti en DATETIME",
	"dateModified": "2017-10-31T06:00:00",
	"deviceState": "ok",
	"ipAddress": "192.14.56.78",
	"hardwareVersion": "v1.1",
	"softwareVersion": "v2.1",
	"firmwareVersion": "v1.0",
	"image": "URL - https://schema.org/image",
	"refSeeAlso": [
		"myDevice-airPollution-31408",
		"myDevice-noiseLevel-15440",
		"myDevice-noiseLevel-208402176",
		"myDevice-salinity-XXXXX",
		"myDevice-noiseLevel-1506330386"
	],
	"source": "http://somlit.mio.univ-amu.fr/#/donnees/7/12/2"
}